{
  "version": 1,
  "revision": 1,
  "companies": [
    {
      "id": 1,
      "name": "BorderMC B.V.",
      "discord": "https://discord.gg/bordermc"
    },
    {
      "id": 2,
      "name": "Iceroad Works",
      "discord": "https://discord.gg/iceroadworks"
    }
  ],
  "stations": [
    {
      "id": 1,
      "name": "Brussels",
      "type": "station",
      "position": [100, 64, 100]
    },
    {
      "id": 2,
      "name": "Ghent",
      "type": "station",
      "position": [500, 64, 100]
    }
  ],
  "lines": [
    {
      "id": 1,
      "name": "Belgian Express",
      "company": 1,
      "color": "#FFAA00",
      "stations": [1, 2],
      "points": [
        [100, 64, 100],
        [900, 64, 100]
      ]
    }
  ]
}
